texto,rotulo
"Paguei o boleto dia 18/12/2017 à vista e atá hoje dia 05/01/2017 ainda não recebi o que paguei... Já recebi varias ligações da loja e da transportadora Directlog e nenhuma das promessas se concretizaram... Tirei 2 dias de folga do trabalho para poder esperar em casa o produto nos dias prometidos por ""telefone"" e nada.. Agora vou trabalhar fim de semana para compensar esses dias folguei do trabalho, realmente uma decepção e uma péssima experiência de compra online, agora é buscar meus diretos na justiça. Aconselho a avaliar melhor do que eu antes de firma compra na site, pois eu não consigo mais confiar na loja.",1
"Produto excelente. Ficou muito bom. meu marido diz que é confortavel e veste bem. Entrega muito rapida,preço muito bom. Ja lavei e continua igual. Parabens",5
"Excepcional produto da Samsung além de ser uma bateria novíssima e original,recomendo a todos que precisarem de uma bateria de alta qualidade para esse mesmo celular sem contar a rapidez da entrega do produto que foi de apenas cinco dias.",5
"Comprei ele, gastei com chip, recarga e nao funcionou. Fica com a luz acesa e nao reconhece o chip. Ligo e só da na caixa postal. Nao funciona. Decepcionado.",1
"Ótimo em tudo, tanto no produto que comprei quanto na entrega do mesmo, chegou até antes do prazo.",5
"Chegou rápido, muito bem embalado e sem nenhum problema.",4
"Bem bolado este kit da construção. Pensei que fosse maior os carrinhos, mas ainda assim eu gostei.",3
Feliz com o atendimento. Produto entregue conforme contato do fornecedor.,3
"Aparelho muito bom, as fotos ficam maravilhosas mas o problema é usar um chip somente.",3
"Chegou muito rápido, jogo muito bom recomendadíssimo!",5
Realmente atingiu os objetivos propostos. Muito bom .,4
Produto que oferece ótimo desempenho e já vem formatado pra receber arquivos de vídeo acima de 4 GB.,4
"adorei! as bebidas sao deliciosas, e a maquina é super rapida. bebida sai bem cremosa",5
"Na apresentação o preço ta 1.322,04 e quando entro no site ta 1.699,00",3
"Produto de qualidade boa, tamanha adequado, recomentdo",3
"Excelente produto. ""Roda"" bem a Netflix, por exemplo.  Entrega antes do prazo.",5
Olha demorei pra comprar mas agora não da pra ficar sem ela......,5
Gostei sim do tênis Mizuno pena que ficou apertado no meu pé só usei uma vez fiquei triste por que apertou o peito do pé,3
Eu não consigo desligar no celular só desliga na tomada e complicado eu acho que deveria ter mais explicação  como usar o aparelho.,3
"Adquiri um otimto produto por um preço bem em conta, estive por um tempo pesquisando por um secador de cabelo de uma marca boa e com um preço em conta... Mais minhas pesquisas logo se encerraram qdo encontrei este Secador de Cabelos Ph3700 PinK PHILCO é um excelente produto. Um carinho especial para os meus cachos...Eles e eu mereço o melhor!rsrsr",5
"uma das portas veio amassada, e foi um amassado grande, fora isso tudo ok. só não dei a nota exelente por causa desse inconveniente.",4
Chegou bem antes do prazo estipulado... Muito bom!,5
"Comprei uma bomba para uma altura de 1 m, porém a minha altura é de 2 m. Pensei que. como precisava um fluxo bem pequeno, a dita cuja serviria.   Vou usuá - la em um aquário que irei construir.  Por favor, podem enviar - me enviar uma que eleve dois metros.",3
Perfeito compra ótima sie maravilhoso entrega rápida e tudo certinho ameiiii,5
"Minha mãe que comprou pra ela. Está gostando muito.A memória é grande cabendo todos os ""flashes "" dela e todas as ""pérolas"" musicais rsrs.",4
"Boneca totalmente diferente da que aperece na foto. O cabelo parece um material usado para enchimento, não sei bem dizer o que é mas tem as falhas e não se parece nada com cabelo. É uma boneca normal, como essas que encontramos em qualquer loja de brinquedos pelo preço bem mais em conta. Fiquei com vergonha de dar essa boneca de presente para minha filha. Informei a loja que o produto chegou avariado, com manchas pelo rosto e corpo, devido ter vindo embrulhada em papel crepom. Não obtive resposta da loja, descaso total com o cliente.",1
"Sim, celular lindo. Gostei muito. Preço excelente! Entrega sem demora.",4
faz o que promete... bom desempenho para aplicações diárias e jogos com bons gráficos.,4
"No anuncio muito bonito, mas na realidade qualidade bem inferior pelo preço não vale a pena.",1
"Produto de ótima qualidade, a duração da bateria é incrível!",5
"Muito boa a apresentação do livro. Interessante fazer um ""diário"" por 5 anos... ver as mudanças que passamos...",5
Produto adquirido conf. noticiado no site e entregue com antecipação...,4
"Fiz a compra do produto no ano passado, desde então estou no aguardo. Obtive retorno informando que realmente houve um problema no fornecedor e que eu deveria aguardar. Estou no aguardo desde então. Mas como muito receio de que passado o prazo dado (02/02) eles me informem que o produto não foi possível enviar.",1
Quando chegouu achei que o som era baixinha pq é tá pequeno mas me surpreendeu.,3
"Nota 10 para o produto.Atendeu as expectativa, Américas.com como sempre entrega no prazo.",5
Comprei uma peça e chegou outro conjunto chegou foi um conjunto de taça pra sobremesa,1
"Galera, só pra ficar avisado, essa máquina é realmente boa, no entanto somente pra quem quer passar a zero. Tenho ela faz uns quase 3 anos, uso frequentemente pra raspar a cabeça e me serve muito bem. No entanto, usar o pente dela é bem chato. Acumula muito cabelo e não corta uniformemente. Muito mal projetado. Ou seja, SÓ COMPRE SE NÃO FOR PRECISAR USAR O PENTE.",5
"Amei esse produto, muito bom, deixa a pele dos pés super macia,recomendo.",5
"Estou super satisfeito com o produto , qualidade e confiança.",5
"É um celular grande, rápido e com muita memória. Na minha opinião, possui muitas vantagens quando comparado com outros na mesma faixa de preço.",4
Tive problema no prazo de entrega . Mas chegou. Com uma ruim mas veio. É achei que fossem mais fortes,3
"Achei maravilhoso, super potente, agora vamos ver a conta de luz quando chegar,kkkkk e tb achei muito confortável o manuseio a posição não é cansativo que nem outros que ja tive de outras marcas, adorei, super recomento.",5
"Excelente promoção, por esse preço você levaria somente o canudo, nessa promoção o copo vai grátis!",5
"Gostei muito do produto, boa qualidade e muito bonita.",4
Fica muito bonito e o preço um dos melhores do mercado! Atendimento da loja lcg eletro nota 10!,5
Ótimo custo benefício Americanas arrasando na entrega,4
Entrega antes do prazo estipulado. Excelente produto!,5
"A piscina é linda realmente,""minha filha amou"", porém ,produto muito frágil,usamos  2 vezes e já se acabou, frustante demais para criança!",1
"o Produto atende as expectativas, bem como sua funcionalidade.",5
"Todo livro é interessante. Acho muito legal que as Americanas estejam trabalhando pela popularização do conhecimento. Poderia ser  barato, no entanto, o livro. Cultura não pode ficar restrita, mas ampliada para todos, sem exceção.",3
Produto fedendo a mofo e claramente muito degradado. Provavelmente a forma de armazenar e guardar é péssima. Deveriam ter vergonha de enviar uma coisa tão suja e fedorenta.,2
"Comprei tamanho G, a variação dos tamanhos é enorme, umas ficam muito apertadas, outras largas, todas com a etiqueta do tamanho G, as costuras também cederam no primeiro dia de uso, não indico esse produto!",1
"Impressora compacta, resistente, veloz,  Só não é dez por não imprimir colorida!",4
"Elíptico excelente. Recomendo!  Atrasou a entrega, mas chegou tudo bem.",5
"O produto é de excelente qualidade, faz jus ao que preconiza.E de baixo custo.",5
"Vocês são realmente caras de pau, meu produto foi comprado dia 08-12-2017 e confirmado dia 11-12-2017 e até agora vcs não me entregaram, falta de respeito total com o consumidor, eu deveria ter pesquisado antes de compra nessa loja.",1
Amei a cadeira. comprei para o meu netinho e ele adorou.,5
produto atende 100% minhas necessidades e expectativas.,4
"muito boa capinha, material otimo recomendo a todos e está num bom valor.",5
"Produto bom e barato,entrega no prazo e recomendo por ser motoqueiro.",5
"O produto é muito bom e bonito, funciona com uma potência incrível além de ser decorativo na cozinha. Até comprei outro para dar de presente!!!",5
"Cumpre exatamente o que promete, faz a sua função.",4
"Forno não aquece corretamente , não assa só esquenta, já pedi  para que seja feito a troca e até agora estou esperando.",1
O produto corresponde ao q eu estava necessitando . com memorial interna dentro do padrão necessário.,4
adorei  ...aparelho muito bom e fácil para manuseá-lo,4
COMPREI E NÃO RECEBI E A AMERICANAS MANDA E-MAIL PARA EU AVALIAR?? NÃO RECOMENDO,1
"Superou e muito minhas expectativas,ótimo custo benefício,é uma maquina com um designer moderno e que cumpri seu papel 100%.",4
"Super recomendo este perfume, um cheiro muito agradável e que dura por muita tempo.",5
"Gostei muito do produto, de boa qualidade mas no anuncio não fica claro que o produto NAO possui tampo superior.",3
desperta o desempenho do jogador na tentativa de acabar com a missão,4
"muito bom, recomendo, entrega super rápida, a forma de se rastrear os objetos no site está muito boa e isso é importante na hora de escolher o site pra comprar em relação a outros que nem ao menos dar para rastrear seu produto comprado.",4
"MUITO LEVE E PRATICO FÁCIL DE LEVA, ÓTIMO PRA TRABALHOS DE FACULDADE.",5
Chegou antes do previsto e minha namorada adorou. só anda com ela agora.,5
"Ainda não recebi o produto, comprado em 01/12/2017.",1
"Qualidade excelente, bem feita e ela é muito bonita, me surpreendeu quando chegou.",5
"O produto é leve de fácil utilização muito pratico, imagem ótima e a bateria dura bastante,  Adorei recomendo",4
Excelente compra! Produto de ótima qualidade e loja com ótimo atendimento e serviço! Mariana,5
Balança atendeu bem as expectativas. Compacta e funcional.,4
"Ótimo custo benefício, o cesto para os alimentos  tem um bom espaço, colocando uma quantidade considerável de alimentos, sendo possível frita-los de uma só vez, sem necessidade de repetir o processo para mais porções. Usa muito plástico, mas o acabamento e bom e o preço é justo pelo q oferece.",4
"Muito bom mesmo , adorei, chegou no prazo e o atendimento é ótimo , recomendo",5
"O sabor da comida fica excelente, amei muito!!! Mas, infelizmente, em 2 semanas de uso está saindo o teflon da cuba, mesmo sendo lavada com todo o cuidado. Teflon de péssima qualidade.",2
"Não gostei do fixador desse perfume, é muito fraco, minha filha usava esse mesmo perfume, porém comprei em outra loja, e o fixador era excelente, durava o dia todo. Não compro mais nesta loja.",1
Estou muito satisfeita superou minhas expectativas.,5
"A compra foi mto boa, fiquei satisfeito com vendedor, tbm c a entrega, certamente recomendo e voltarei a comprar.",5
muito bom para quem mora em lugares muito quente e seco.,4
O produto e bom o problema e o tamanho do cabo muito pequeno e nao tem a opção  de aumentar fiquei um pouco frustada.fora a entrega que levou um mês  para ser feita,3
Só o microfone que dá muito ruído...mas o aparelho já tenho igual ...da mesma marca faz mais de três anos sem nenhum defeito e a bateria ainda dura umas três horas...,5
Produto entrregue antes do prazo. Mas de forma imcompleta. E ninguém da atenção para resolver o problema. Ja mandei muitos e-mails e demoram muitonpara resolver o problema. Muito triste com a loja que nao tem um telefone para falar sobre isso e por e-mail simplismente não respondem mais,2
Ainda não recebi o produto e estão querendo que eu faça avaliação!!,1
"fiquei muito chateada, pois comprei com um mês de antecedência do natal, para dar de presente para minha filha e na semana do natal, recebi um e-mail informando que tentaram entrar em contato comigo por diversas vezes e não conseguiram, para informar que a cor escolhida não tinha disponível e simplesmente cancelaram a venda. Achei bizarro, pois não tinha nenhuma chamada no meu celular e muito menos algum e-mail, informando este feito.  Muito insatisfeita.",1
"gostei muito das cadeiras. a qualidade é ótima, especialmente pelo preço. a base é de ferro, resistente, os assentos confortáveis... estou muito satisfeita. achei um pouco complicada a montagem, mas depois de pronta, ficou ótima!",5
"Funcionabilidade, memoria, tudo ótimo! Poucas vezes se consegue foco da câmera traseira com dificuldade e a frontal a imagem(por ser 5MP) não é tão boa.",3
"As americanas venderam o produto com ótimo preço, entrega rápida e só elogios. Mas o OFFICE está cada vez pior. Na tentativa de forçar a você fazer a renovação automática e pagar quase 3x o valor da nova chave, eles dificultam muito a renovação. Como esta é uma licença para 5 dispositivos, e a MS não consegue fazer isso funcionar bem, é um grande stress.",2
Gostei muito do produto! A entrega foi conforme o combinado. Eu recomendo!,5
Edtou aguardando até agora e não entregaram comprei para dar de presente de natal duas semanas antes do natal e até hoje não chegou .,1
Entrega antes do prazo e em perfeito estado. Produto de alta qualidade. Meu filho amou.,5
Gostei muito porque firma bem todas as cordas e não deixa trastejar !,5
'..................................................,5
"Comprei pelo site e por distração minha não percebi que era um produto para idade de 9 a 14 anos. Meu neto tem seis anos. Até hoje não conseguimos montar o produto. Estou atrás de um professor ou alguém que possa montar o produto.  Isto causou um grande desconforto e uma enorme ansiedade para o menino Foi um erro meu, mas sugiro que este tipo de informação seja mais clara.",2
A boneca chegou antes do prazo e ela era linda. Recomendo o site e os produtos.,5
Não recebi m***** nenhuma e comprei há 1 mês!!! Pessimo atendimento.,1
Difícil é trabalhoso de manusear.  Para quem quer facilidade na cozinha ele só traz problemas.,1
"É pequeno, mas pra mim está ótimo. Me ajuda muito pra não ficar abaixando o tempo todo.",5
"Chegou super rápido,2 semanas antes do prazo. E o produto é excelente, recomendo muito, e vou comprar mais nesse site. É maravilhoso.",5
"Adorei ! Ótima qualidade ,muito bom material excelente . O tempo de entrega foi ótimo.",4
Atrasou a entrega e fiquei na mão para dar o presente do meu irmão,4
"ótimo produto, tem uma excelente performace, conforme expectativas!",4
"Produto atende bem a minha necessidade , sem problemas na entrega e dentro do prazo . Recomendo a compra .",3
"Tenho o produto faz pouco tempo, mas até o momento me atende prontamente a necessidade!",4
"Bolsa de excelente qualidade e linda , eu amei, entrega como sempre super rápida.",5
Ótimo! Excelente Produto! Muito Satisfeito com o Aparador de Pelos Philips! Valeu cada Centavo! e Comprar na Americanas pra Mim é uma Honra! Entrega Dentro do Prazo! e como sempre... Excelentes Preços! Eu Recomendo Sim á Americanas sem Sombras de Dúvidas! ;),5
"Produto de qualidade e em ótimo estado de conservação, Recomendo à todos que querem comprar cds e DVDs, Nas lojas Americanas você tem qualidade, São os melhores produtos.",5
"Ótimo produto, podem comprar. Vcs não vão se arrepender.",4
"Muito bom, rapidez na entrega, chegou antes da data prevista ótimos preços e produtos de qualidade.",5
Nada opinar so tenho a reclamar desse formulário. Que eu não quero opinar,4
"Celular muito bom! Excelente custo x benefício. Recomendo a compra. A entrega  foi perfeita, o aparelho chegou antes do prazo previsto.",4
Até o presente momento não tenho do que me queixar deste produto. Excelente!!!,5
"Bom produto, recomendo o produto e entrega muito rápida. Americanas é muito boa",4
"não recomendo, só dor de cabeça, comprei 02 kits e dentre eles veio 3 marcas diferentes, queima toda hora. optar por produto de 1 ano de garantia e por marcar nacionais",1
"O celular veio com defeito, não ligou. E para entrar em contato com a Americanas foi muito demorado e somente mensagens automaticas. O retorno foi demorado.",1
"Minha filha de 8 anos ficou louca com o presente, quer brincar de baladinha todos os dias com as amiguinhas agora.",5
"Descaso total com minha entrega, fazem mais de 40 dias que comprei o produto e o mesmo ainda não chegou.",1
Então esse produto em apenas nem 2 semanas de uso já deu defeito..,2
Super recomendado! Bom que esperei passar os preços de Natal para comprar =)  Começou bem o ano estagiário ;),3
Recomendo o produto para aqueles que querem iniciar o nível intermediário 1.,4
"estou satisfeito com o produto, recomendaria para outros gamers",5
"Ainda não o li, mas ele veio muito bem embalado, entrega dentro do prazo (até antes, na verdade) e em perfeito estado!",4
"Estamos satisfeitos com o produto. E chegou muito rápido.  Parabéns. Recomendo, O produto e Americanas!!!",5
"Como outrora noticiado, me enviaram o produto errado, que foi prontamente devolvido à ""empresa"" DUPLOR MÁQUINAS, segundo o rastreamento via correios, dito produto, uma Tícia, que deveria seguir para o Rio de Janeiro, foi entregue na empresa no dia 18 p.p.; apesar de vários contatos via fone, as atendentes afirmavam que não encontravam tal devolução. Após várias promessas, na  ultima disseram ter encontrado a máquina do equívoco e que o que eu havia comprado e PAGO, seria enviada via sedex, não foi até hoje....03.01.18.  Será uma empresa mesmo séria?? comprometida com o consumidor??",2
O j5 é tem configurações muito melhor  Tenho os dois!,3
"Produto excelente e com precinho oh!. Não sei como consegui viver até hoje sem um copo de acrílico de quase 2 mangos. Agora com este copo minha vida mudou!  Levo o copo pra passear, dou banho, boto pra dormir. Cuido dele com o todo o amor e carinho!",5
otimo produto ele supreendeu minhas espectativas eu os a indico top de linha o J7 mental,5
Um mês e 5 dias da compra e ainda não recebi!!! Absurdo!!,1
O produto não tem o aplicativo do Netflix e não pode ser instalado. O áudio também é bem ruim...,2
"Exelente,era exatamente oq eu esperava,obg,Camera tem otima qualidade e tela muita nitidez.",5
"Entrar em contato 11947571975 Smartphone Motorola Moto Maxx Android 4.4 Tela 5.2"" 64GB Câmera 21MP - Preto",5
O produto superou minhas expectativas em termos de qualidade.,4
"Minha filha adorou, gostou muito! Recomendo o produto!",5
"MUITO LEVE E PRATICO FÁCIL DE LEVA, ÓTIMO PRA TRABALHOS DE FACULDADE.",4
"Produto de qualidade ruim , devido a isto pedi o cancelamento do pedido (02-655803699) dentro do prazo estipulado por lei, às Americanas encaminharam à loja responsável, mas a parceira  Glamor cancelou a solicitação, portanto infelizmente a  Americanas ecommerce a qual sou cliente a muitos anos (podem buscar ai nos registros), fez parceria com uma empresa sem idoneidade, pois são desfavoráveis aos direitos do consumidor mesmo que possam sofrer processos. Como a loja Glamor se recusou a fazer o cancelamento solicitei a intervenção das Americanas , mas até hoje não me retornaram a solicitação realizada pelo próprio método de sistema deles enviado por email pós cancelamento da solicitação da Glamor. Estarei reclamando em redes sociais e Reclame Aqui, foi meu primeiro problema com um parceiro da LA e consequentemente com as Lojas Americanas que deu a cara a tapa por parceiro ruim. Irei ao Procon com o e-mail que a Glamor enviou se negando a cancelar o pedido em que fiz por descontentamento ! pois o produto pareceu até falsificado por baixa qualidade perante ao de perfumaria física , indiferente a isto, sendo ou não sendo verídico o produto eu pedi o cancelamento por arrependimento de compra e estão me negando o direito. A partir daqui tomarei providencias já que a loja Glamor se negou a cumprir a legislação !",1
"Gostei do produto, entrega surper rápido.  Produto muito bom cumpre o que promete",5
"Sem dúvida alguma, conforto e elegância definem Piccadilly. Um sapato lindo, confortável, e a esse preço, sem dúvida nenhuma a melhor compra da vida.",5
bom produto. atendeu as minhas expectativas..............................,4
"Ciamob um lixo de empresa, prazos de entrega super longos e falta de comunicação com o cliente! Não recomendo pois ainda não recebi",1
A americanas sempre me da o suporte necessário e todos os produtos chegam ate mesmo antes do prazo super bem embalado super recomendo as compras realizadas no site a anos comprando nunca tive problemas,4
"O melhor copo de acrílico que já usei na vida! A água fica purificada, com um gosto excelente. Vale muito a pena cada centavo!",5
"Nunca vi um produto demorar tanto para ser entregue. Comprei 05/12/2017 e praticamente 30 dias depois ainda nao Recebi. Como comprar das Americanas se já demoram mais que os sites Chineses? Vocês não se preocupam com a concorrência? Que tipo de serviço imaginam prestar? Simplesmente ridículo um produto que a priori deveria estar pronto levar 30 dias para ser entregue dentro do território brasileiro. Se eu morasse na floresta amazônica até justificaria, mas moro na região metropolitana de uma capital do sul do país.",1
produto com qualidade original hp. a multifuncional reconheceu sem problema,5
"As câmeras não tem a minima resolução necessária para identificar uma pessoa, imagens péssimas, sem condição.",2
"Um ótimo celular o Moto Z2 Play, sistema operacional é rápido e fluido, mesmo com vários aplicativos aberto não há lentidão. A leitura de digital é excelente, muito precisa. O design bonito (mesmo com capa de proteção) somado ao peso minimo do aparelho fazem do Moto Z2 Play um dos celulares melhores que já comprei, se não o melhor!",4
Jogo para familia. Muito divertido Engraçado. Une mais a familia,4
Comprei descascador e cortador de frutas e legumes mas me entregaram descascador de maçã,1
"Amei meu celular, além de lindo, tem uma ótima memória...",5
"O televisor é muito bom e com muitas características, eu comprei para principalmente assistir Netflix, e a tv faz isso muito bem. A resolução não é Full HD mas isso não é um problema para mim, a imagem é ótima. Gostei muito da recepção WIFI da TV, que é superior ao do PS4. Instalei ela bem distante do roteador e não tive problemas. O controle não é Air Mouse, o que dificulta um pouco quando se quer digitar algo. Eu tenho um outro televisor que é de 60hz, e a diferença é nítida comparada a este aparelho que é de 120hz. O design também me agradou.  A única coisa realmente ruim da TV é seu som. Que não tem uma boa potência. Então se você pretende ouvir musica alta, esquece.  Levando-se em consideração o valor do aparelho eu acho que é uma boa compra.",3
TV de custo/benefício muito bom. A Americanas é uma excelente vendedora. Achei a TV que eu procurava!!,5
gostei muito do produto...chegou antes do prazo em perfeitas condições. Super indico!,4
"Produto de ótima qualidade, tamanho razoável e prático.",4
"Essa TV foi feita para se assistir de frente. Nessa posição a imagem é excelente. Porém, assistindo de um ângulo inclinado (e não precisa ser muito inclinado), a imagem fica horrível, perde a cor e fica esbranquiçada.       Isso ocorre devido à sua tela ser do padrão VA, que possui excelentes níveis de contraste quando se assiste a TV de frente, mas perde a qualidade da imagem à medida em que nos deslocamos para os lados (já as telas IPS não oferecem os mesmos níveis de contraste, porém mantêm a qualidade da imagem mesmo quando se assiste a TV de um ângulo inclinado).       Só descobri isso após comprar a TV e pesquisar na internet para saber o motivo da imagem ser tão esbranquiçada de um ângulo inclinado. Infelizmente já havia passado o prazo para devolução quando testei a TV.      Quanto às demais funcionalidades, ela é muito boa e sua navegação na internet é bem rápida. Só o controle remoto que é bem simplório e o som da TV é um pouco baixo.",3
"Não conhecia, ótimo perfume, entrega perfeita, bem antes do prazo estimado",4
"Livro mais completo e organizado do que as edições anteriores e excelentes materiais suplementares, como questões de concursos e práticos quadros editáveis da NR4!",5
"Até o momento, não tenho reclamação do produto. Gostei, recebi dentro do prazo.",3
Produto não recebido até o momento Pedido postado em 12.12.17 previsão de entrega 27.12 e até hoje o status da entrega não. Muda.,1
"Gostei do produto, Tem boa qualidade, mas, a tampa não está devidamente ajustada.",3
"Ótimo produto,entrega antes do prazo, veio muito bem embalado , perfeito, super recomendo",5
"A tv  é ótima porém não tem  aplicativo netflix, entrega super rápida, recebi antes do combinado.",3
Produto muito bom atendeu minhas expectativas  recomendo sem sombra de duvidas,5
"Os tipos de toque são muito baixo, difícil de se escutar tocando.",2
"indicarei para os amigos , pois tanto como os produtos como o atendimento excelentes obrigado.",5
"Com exceção que veio a marca Verde ao invés de Jl  Protect,  funciona super bem.  Essas coisas chinesas são bem parecidas mesmo.",4
Me atendeu em tudo o que estava procurando em um smartphone.,5
Atende as necessidades. Fácil instalação. Bom para ambientes pequenos.,3
"Recomendo lindo !!!excelente...,corresponde minha necessidade,rapido sem palavras ,compraria de novo 10,.",5
"otimo gostei muito alem de muito mais carga, recomendo",5
PRODUTO NÃO CHEGOU!!!!!!!!! QUERO O PRODUTO OU MEU DINHEIRO DE VOLTA URGENTEMENTE!!!!!!!!,1
"Minha esposa sugeriu a compra para um sobrinho que não se interessa por qualquer brinquedo, e ele gostou e durante a viagem após o recebimento alternava a atenção co outro que ele tem como preferido, isso para  já nos alegrou .",5
