texto,rotulo
Bom dia! Gostaria de saber se vem acompanhado o balcão,3
Otimo recomendo. Estão de parabéns. .....................,5
Pelo preço vale a pena..Minha filha gostou e guarda seus shopikns na maleta,3
"produto bom, cor bonita material de boa qualidade e chegou no prazo",3
"Um ótimo produto, chegou em 7 dias aqui na minha residência. Já veio carregada! Um excelente produto! Na loja está 200 reais, aqui no site comprei de 106 reais incluído o frete, parabéns lojas Americanas, sempre no topo!",5
"A imagem cria uma impressão que o produto é muito maior. A descrição no anúncio não diz que para estourar a pipoca tem que colocar  uma colher de óleo. O produto é cheio de ""orelhas"" penduradas para o fechamento, o que torna muito complicado lavar após o uso. Muito mais simples usar uma panela comum para estourar pipoca!!",1
"NÃO PUDE TESTÁ-LO, POIS ESTOU NO AGUARDO DA CAPA. O CELULAR COM O KIT CARTEIRA É PRESENTE DE NATAL (NATAL 2017). SÓ RECEBI O CELULAR, DE FORMA QUE AINDA NÃO POSSO AVALIAR, POIS O PRESENTE NÃO FOI ENTREGUE.",3
"Não recebi o produto,  estou indignado  o produto foi comprado dia 8 de dezembro  para entrega  dia 21 de dezembro  e até  agora  não  recebi  vou ao procon. Estou  esperando.",1
Ótimo produto porém após a compra encontrei em minha cidade mais barato.,4
"Veio antes do prazo de entregar, chegou como pedi..tudo certo",5
"Produto de Qualidade, com bom preço. Vale a pena a economia",4
eu não recebi o produto pois havia cancelado a compra e ninguém me deu retorno do cancelamento da compra,1
"Olá... primeiramente quero deixa bem claro que vou procurar Procon. meu transtorno começou a partir do dia 21/12/2017, quando o produto comprado não chegou. procurei mandar um e-mail, que claro foi respondido falando que meu produto ia chegar dia 29/12/17. Mais como isso pode acontecer!??????? sendo que na hora da compra não tinha nenhum aviso, ref a isso.... blz... então seguir esperando.... deu dia 29/12 e nada, absolutamente nada do produto. novamente mandei e-mail, explicando produto em atraso.... bom, por fim... meu produto chegou por volta das 14h, do dia 03/01/18. olha que transtorno. Mais ainda não chegou ao fim!!!!!!!!!! quando chego em casa que vou olhar o produto. (BUUUUUU) SURPRESA .... NÃO ERA O COLCHÃO QUE COMPREI NO SITE!!!! MODELO TOTALMENTE DIFERENTE.... ENTÃO ESPERO CARECIDAMENTE UM RETORNO.(NÃO ERA ESSE A IMAGEM QUE EU TINHA DAS LOJAS AMERICANAS)  CONTATO: (11) 931482966.   TENHO PROVAS! FOTOS ... E-MAIS E MUITO MAIS....",1
otimo produto recomendo a todos .loja entregou super rapido.,4
"Superou expectativas  É excelente para jogos, super rápido tela full hd tamanho ideal leve e Pratico",5
Já tinha o mesmo produto e comprei mais um para dar de presente. O custo beneficio vale.,5
serve para qualquer ocasião para festas. no tamanho otimo,3
Chegou rápido e realmente cumple minha expectativa,5
"O produto é ótimo pq já usei comprando em outra loja porém estou aguardando a 1 mês a chegada do produto na minha residência e a resolução do problema,ou devolução do valor,porém só me enviam email de avaliação e pedido de que aguarde respostas. Muito demorado o atendimento. Espero uma resolução breve.",4
Produto muito bom já veio com uma pelicula boa. Excelente entrega da Americanas chegou uma semana antes do previsto.,5
"Gostei do produto e chegou antes do previsto, porém, veio faltando uma pecinha para montar a roda",5
Considerei o mine frigobar muito pequeno e gela pouco! Na verdade só atende longas viagens ou carros que permanecem com o isqueiro funcionando mesmo que desligado o motor.,3
Madeira de qualidade razoável e com o as bases soltando onde poderia ser colada além de encaixada. A dobradiça soltou o pino sem nem mesmo ser usada.,2
produto atendeu exatamente minhas expectativas. Resolveu meu problema com o hd externo no wii u,5
"Demorou de chegar, mas era treta dos correios, no mais é bonzão o produto.",5
Teve um pequeno atraso pôs era final do ano mas sem problemas. Produto chego.,4
O produto não chegou no prazo.  Vou entrar com uma ação judicial.,1
Nao gostei demorou entregar e ainda veio errado o tamanho,2
"Lamentavelmente o fornecedor ainda não me enviou o produto, motivo  pelo qual não tenho como avaliá-lo. Gostaria da interferência dos senhores, para que o produto seja entregue. Atenciosamente,  Luiz Carlos Monteiro da Silva",1
Produto ótimo custo/benefício. Só demorou um pouco para chegar e veio sem a nota fiscal. Imprimi nota que foi enviado por e-Mail e pronto. Recomendo.,5
Material de qualidade e fácil montagem. Sugiro que quem for montar tenha uma parafusadeira elétrica.,5
Ele é muito eficiente para passar as roupas! Facilita bastante o trabalho.,5
Entrega dentro do prazo! E funcionando  perfeitamente,5
"É um excelente sistema para quem não quer ter dor de cabeça ao configurar ou para quem não conhece muito bem redes IP. Troquei dois repetidores que tinha (e que só davam problemas) por este sistema. O APP para Android/Iphone é bem simples de operar e bastante interativo durante a configuração da rede. A cobertura parece boa, mas ainda não testei até os limites de meu imóvel. Só achei um pouco caro.",5
"Como Avaliar um produto q nem efetuaram a troca pra mim? Aguardo orientações d como efetuar a troca mas sem respostas... como enviam produto diferente do q comprei? Torneira com filtro cromada foi o q comprei e me enviaram a branca q é metade do preço, se ta dificil efetuarem a troca quem dira devolver meu dinheiro... tem jeito d me atenderem corretamente?",1
"Ótimo produto pelo custo benefício, recomendo, pois há outros produtos na prateleira que proporcionam o mesmo resultado, mas porém mais caro. Meu filho aprovou.",4
"Produto maravilhoso, muito chique, eu recomendo a todos que desejam um produto para dar um toque especial na sua cozinha.",5
"Design lindo. Qualidade da imagem maravilhosa. Pena que não vem o controle smart tv Magic. A lg podia pensar sobre isso, pois o produto é ótimo, mas ficaria excelente com o controle Magic.",5
"Ja tenho um j7, mas como estava em promoção resolvi compra esse, que tambem é otimo",5
O produto atende muito bem ao fim que lhe é destinado.,4
"DENTRE OS OUTROS CELULARES COM PREÇOS SEMELHANTES, ACHEI O MELHOR...CUSTO BENEFÍCIO",4
O tamanho foi a única coisa q achei diferente. Muito bom o produto e entrega rápida.,4
"Excelente produto, gostei muito e recomendo sua compra",5
"Muito bom e entrega super rápida. . Produto de excelente qualidade, super recomendo podem comprar é otimo. ..........",5
", o pedido foi cancelado a um mês e até agora nada.",1
"Produto ótimo, conforme o esperado. Gostei! Produto ótimo, conforme o esperado. Gostei!Produto ótimo, conforme o esperado. Gostei!Produto ótimo, conforme o esperado. Gostei!Produto ótimo, conforme o esperado. Gostei!Produto ótimo, conforme o esperado. Gostei!Produto ótimo, conforme o esperado. Gostei!Produto ótimo, conforme o esperado. Gostei!Produto ótimo, conforme o esperado. Gostei!Produto ótimo, conforme o esperado. Gostei!Produto ótimo, conforme o esperado. Gostei!Produto ótimo, conforme o esperado. Gostei!Produto ótimo, conforme o esperado. Gostei!Produto ótimo, conforme o esperado. Gostei!Produto ótimo, conforme o esperado. Gostei!Produto ótimo, conforme o esperado. Gostei!Produto ótimo, conforme o esperado. Gostei!Produto ótimo, conforme o esperado. Gostei!Produto ótimo, conforme o esperado. Gostei!Produto ótimo, conforme o esperado. Gostei!Produto ótimo, conforme o esperado. Gostei!Produto ótimo, conforme o esperado. Gostei!Produto ótimo, conforme o esperado. Gostei!Produto ótimo, conforme o esperado. Gostei!Produto ótimo, conforme o esperado. Gostei!Produto ótimo, conforme o esperado. Gostei!Produto ótimo, conforme o esperado. Gostei!Produto ótimo, conforme o esperado. Gostei!Produto ótimo, conforme o esperado. Gostei!Produto ótimo, conforme o esperado. Gostei!Produto ótimo, conforme o esperado. Gostei!Produto ótimo, conforme o esperado. Gostei!Produto ótimo, conforme o esperado. Gostei!Produto ótimo, conforme o esperado. Gostei!Produto ótimo, conforme o esperado. Gostei!Produto ótimo, conforme o esperado. Gostei!Produto ótimo, conforme o esperado. Gostei!Produto ótimo, conforme o esperado. Gostei!Produto ótimo, conforme o esperado.",5
Demorou 1 mês pra chegar na minha casa e além disso veio com defeito (não esquenta),1
"Chegou em ótimas condições, tem uma ótima história e é fiel ao desenho",5
Não chegou nada prazo de entrega ultrapassado sem dar nenhuma resposta concreta,1
Não concordo em ser obrigado a fazer um comentário,5
o produto e que eu esperava porem a entrega foi apreensiva......acho que por causa do Natal,5
"O ropeiro chegou no prazo , porém com as portas riscadas, gostaria de trocar as peças que vieram estragadas ,mas não consegui contato com a empresa até o momento",2
Indico para todos que querem conhecer a prática da acupuntura.,5
"O jogo está longe de conseguir se igualar aos antigos Tony Hawk. A jogabilidade e os desafios não são dos melhores, mas pelo preço que paguei até que vale umas horas de jogo. Nada a reclamar da entrega da Americanas, rápida e eficiente como sempre.",3
A toalha é muito bonita e a entrega foi muito rápida. Recomendo!,5
"Produto bom. Mas é muito pequena para uma TV de 20 polegadas, por ser widescreem fica menor ainda. É uma TV para quartos, cozinhas, monitoramento, etc. Não é uma TV pra sala, a não ser que se more sozinho e a casa seja pequena. É ultra leve, dá até medo de um vento derrubar ela, material parece frágil demais. A imagem é muito boa e o som tem bastante qualidade!",3
"Máquina que simula a máquina de lavar, faz os movimentos, pode por sabão e água que lava as pequenas roupiroupinhas que vieram na máquina. Veio tb 6 cabides e o varal. Muito lindo minha filha amou.",5
"Gostei muito de comprar com as americanas, chegou no prazo estipulado e o produto era exatamente o que estava no site.",5
produto muito fácil de usar recomendo entregou antes do prazo lojas americanas é de confiança pode comprar,3
Excelente material. Muito bem trabalhada. ótimo preço.,5
"TV muito boa, tem ótima qualidade de áudio e som, e reproduz filmes e séries pela porta USB sem nenhum problema. O único problema que encontrei foi por ela demorar um pouco pra ligar e abrir os aplicativos, mas fora isso é uma ótima TV.",5
"FÁCIL INSTALAÇÃO. ENTREGA RÁPIDA MUITO BOM, ATENDE BEM AS NECESSIDADES.",5
"Eu estou muito satisfeita. O tablet é perfeito para tarefas do dia a dia, como ver e-mail, usar app de banco, jogos, videos etc... Carrega ate que rápido e a bateria dura muito. Recomendo o produto!",4
Infelizmente terei que dar uma baixa avaliação para o produto pois ainda não o recebi. Já enviei um e-mail questionando tal situação e também não fui respondido.,1
Foi entregue no endereço errado e não no solicitado no pedido,2
Muito bom! Já conhecia o produto e o preço está maravilhoso e vem certinho!,4
Esse jogo é um clássico da estrela!O piratinha pode pular o quanto quiser que não racha ou quebra!Tenho um mais antigo e esse novo vai para a 3ª geração da família.,5
Produto otimo.. Entrega no prazo ...gostei Recomendo,4
A ASA DO LADO DIREITO QUANDO ACIONADA PULA E SAI DO LUGAR. GOSTARIA DE SABER COMO FAÇO A TROCA OU LEVO EM ALGUM LUGAR PARA OLHAR.,2
"Apenas o tamanho é pequeo pra uma criança de tres anos, pro meu neto de um ano e sete meses ficou perfeito e ele amou",4
"O produto é muito fraco. basico bom pra fazer ligação apenas. camera ruim .trava demais muito lento. pelo preço até vale a pena , mas em materia de qualidade deixa a desejar sem contar que comprei o dourado e me enviaram o cinza...",2
"Achei muito lindo esse conjunto de pote de vidro, essa borracha vermelha de vedar deu um charme rs rs comprei num preço muito bom e a entrega foi super rápida. Parabéns á loja Americanas.com  Att: Ana Lúcia.",3
"Produto testado e aprovado,  qualidade, praticidade, usabilidade,  e preço justo.",4
"produto potente, porem deve consumir um pouco de energia de forma significativa.",4
"testado e aprovado, compativel com minhas necessidades",4
O produto é TOP. Como sempre copag fazendo oq a d melhor,5
"Eu até gostei do celular, só acho que o meu deve ter vindo com algum problema. No começo eu vi que a bateria não estava durando tanto quanto eu achava que iria durar. Tive um A5 antes desse e no começo ele durava pelo menos um dia e meio, o S7 já começou durante um dia, as vezes nem isso. E outra coisa que achei muito estranho, eu só comprei esse celular pra eu poder viajar com um celular bom, dai eu estava no Rio de Janeiro e quando olhei pra ele, estava com a tela trincada, sendo que não tinha deixado ele cair nenhuma vez. Não sei se pode ter sido choque térmico, ou algo diferente. Queria que vocês vicem pra mim o que poderia fazer quanto a isso.",3
"De grande qualidade, na hora da compra a Motorola é a melhor opção",5
Muito satisfeita. Exatamente o que eu precisava para minhas reuniões. Excelente qualidade.,5
Não recebi o produto em referência. NÃO  recebi o produto em referência.,1
"comprei dia 09 de dezembro de 2017 com previsão de entrega até dia 22 de dezembro até hoje dia 04 de janeiro de 2018 as 17:30hs não recebi já reclamei 3 vezes e se quer deram satisfação! se não querem ser enganados como eu fui ,então não comprem.",1
Enquanto nova tá funcionando bem. Minha duvida vai ser quando a borracha do vidro precisar de reposição.  Mas é muito boa a barata.,4
"Tela num tamanho bom, muito rápido e bem leve. Recomendo muito esse produto.",5
"MUITO LEVE E PRATICO FÁCIL DE LEVA, ÓTIMO PRA TRABALHOS DE FACULDADE.",5
Meu sobrinho amou ele tem apenas 1 ano produto atende as necessidades,3
"Excelente produto, ótimo custo benefício, atendeu minhas expectativas e necessidades.",5
"Este é um bom produto para cabelos tingidos. Nutre, dá brilho e ajuda a eliminar o frizz dos cabelos. Recomendo.",4
Só demorou para chegar mais o produto é ótimo.  Super recomendo a aquisição.,4
Só não recebi até agora a nota fiscal.  Não veio anexa ao produto.  Não veio via email.  Então não sei como e quando virá.  Idérito,4
"Fiz a compra de uma faca:Faca Do Chef Lâmina Longa 8 Aço Inox Linha Zwilling Pro - Zwilling,pelo site das lojas americanas,vendida e entregue pela tool box,  porem recebi uma faca:Faca Chef 8” Zwilling Gourmet Zwilling J.A. Henckels,produto inferior e diferente ao anunciado tanto pelo nome como pelas fotos no anuncio.",1
"Ótima, amei mais uma vez Americanas arrasando na entrega. Produto de otima qualidade recomendo muito.",4
"Produto conforme anunciado, este é meu único comentário",4
"Comprei o produto para ser entregue dia 22/12, pois era um presente de papai noel. Dia 19/12 a transportadora informou que houve uma tentativa de entrega e que não havia ninguém em casa. Sendo que tinha. Tentei contato via telefone e internet inúmeras vezes, sem sucesso. Haviam inúmeras reclamações da transportadora na internet sobre o mesmo problema. Abri um chamado no reclame aqui e me deram o prazo de resposta depois do Natal. O que não adiantaria nada. O produto chegou antes do Natal, porém o atendimento e prestação de serviço foi péssima e fez com que eu ficasse muito insatisfeita, preocupada com o presente, corresse em shopping para procurar outra (plano B).",2
"Caros Srs., Não era produto original como mencionado na descrição do produto. Produto com acabamento ruim e pior uma das saídas da fonte de alimentação está com defeito, no caso a saída de 12 VDC. Aproveitando a oportunidade deste espaço, vou reiterar comentários que fiz em outra avaliação. Enviaram a mercadoria para o estado de MG e não RJ onde moro, porém na verdade creio que sequer havia o produto para entrega e usaram um ardil, enviando o produto para outro endereço que sequer existia conforme relatório de rastreio dos Correios.  Com certeza para ganhar tempo e receber o valor de pagamento do produto pela administradora de cartão de crédito. O valor foi estornado, porém, acabou gerando decepção com o ocorrido devido a expectativa de minha filha ter o celular que havia escolhido. A Americanas tem que melhorar a avaliação de seus parceiros, por ser co-responsável em disponibilizar seu espaço para os mesmos e estes eventos estão comprometendo a segurança e confiabilidade que eu tinha em realizar as compras pelo site de sua empresa. Certo que são capazes de reverter estas ocorrências. Sinceramente, Claudio Moreira.",1
"avaliacao de que ?! se o produto nao foi entregue, pessimo atendimento.",1
"Minha esposa comprou 02 escovas, a da amiga dela veio funcionando, mas a da minha esposa não funcionou. Vamos ver se a americanas vai tratar do processo de troca ou devolução rápido como foi a entrega, só depois darei minha avaliação final. Pedido 02-658673268",1
"O aparelho é muito bonito, leve e as câmeras são ótimas. Porém  a saída de som na lateral superior facilita o interrompimento do som dependendo da forma como seguramos o aparelho.",4
"Eu não fui buscar o produto no endereço, porém já fui informado que chegou, minha avaliação é sobre a rapidez da entrega e não do produto visto e testado. Obrigado",5
Excelente para fazer traçados e acabamentos. Não mancha o papel pois seca bem rápido. Recomendo.,5
"É ótimo, porém não veio com nota fiscal! É bem útil, prancha mesmo sendo réplica esquenta e alisa bem. E o modelador é ótimo tbem.",3
A porta so ficou pegando ao fechar nao sei se foi por motivo da montagem! Mais e muito bom espaçoso.,3
"Não gostei , qualidade horrível paguei mais de 40,00 por um produto que na minha opinião não vale nem 5,00",1
"Comprei esse microondas na black friday e depois que eu paguei o boleto vocês confirmaram a compra e simplesmente cancaelaram a venda. Alias, péssimo serviço de atendimento. Por mais que tentemos resolver as coisas nunca se resolve. Quero meu dinheiro de volta.",1
"ASUS surpreendeu pela câmera de alta resolução que embeleza, os níveis de segurança permissionados e os apps de proteção e melhoria do aparelho. Estou adorando!",4
"Gostaria muito desse copo,mas o frete no valor de r$4,69 atrapalhou a negociação",3
Em relação ao preço o brinquedo  é muito bom.  Funciona direitinho em curta distancia.,3
"Previsão de entrega dia 02/1 e até gora nada. Atendimento por telefone NÃO funciona não acham o pedido e não tem como falar com nenhum atendente. PÉSSIMO PÓS-COMPRA. Já registrei no RECLAMEAQUI. Se não responderem até segunda-feira, vou pedir a devolução do dinheiro.",1
"A ENTREGA FOI OTIMA E COM RAPIDEZ. O PRODUTO VEIO EMBALADO A CONTENTO, APROVO E RECOMENDO",5
Parabéns a lojas Americanas pela entrega sempre rápida e eficiente. O produto atende as minhas necessidades.,3
"Produto igual à da imagem, chegou no tempo esperado e sem nenhum problema.",5
"Quando comprei, pensei que era um TV Smart. Comprei sem prestar atenção nas descrições do produto. Mesmo assim, produto atendeu bem as expectativas e como tenho Chromecast o problema de não ser Smart foi parcialmente resolvido.",3
produto muito bom!! excelente design!! faz tudo o q foi prometido,5
Ótimo  muito fácil  e versátil. Recomendo a compra......................,5
"Super 10!!!!. Um produto que eu recomendo para quem viaja muito e precisa de espaço na mala, além disso é pequeno, prático e leve sem perder sua potência. Eu recomendo.",4
Produto de qualidade adequado à prática de atividades físicas.,5
"ESTOU ENTRANDO EM CONTATO COM O RECLAME AQUI PARA VER SE TENHO ALGUM RETORNO DE VOCÊS, O PRODUTO ESTAVA PREVISTO PARA SER ENTREGUE ONTEM, E ATÉ AGORA NÃO CHEGOU. IMPOSSÍVEL TOLERAR UM ATRASO, SENDO QUE A NOTA FISCAL FOI EMITIDA DESDE O DIA 29/11 E ATÉ HOJE NÃO SAIU DESSE STATUS",1
Produto muito bom custo beneficio é ótimo a entrega foi antes do prazo .gostei e indico,4
"É um bom celular. Câmeras boas, mas senti falta da estabilização óptica. Bateria boa, tela também. O único ponto que deixou um pouco a desejar foi que logo nos primeiros dias o celular já começou a dar umas travadas. Não esperava isso da linha A",3
"O Smartphone Moto G 5S Dual Chip Android 7.0 Tela 5.2"" Snapdradon 32GB 4G Wi-Fi Câmera 16MP - Prata é muito bom, indico a todos..",4
Nao  recebi esse produto estou a dias procurando noticias do envio sem retorno. Por favor informem a previsao . Aqui esta como entregue mais nao houve a entrega .,1
"comprei ela instalei no carro e depois de 6 meses comecou a travar e desligar sozinha , levei em uma equipadora , o tecnico disse que niguem mexe , agora fiquei no prejuizo.",1
"recebi o produto e ele não está funcionando, mas a empresa que vendeu (JP CELL) deu um retorno surpreendente rápido se dispondo a trocar ou devolver o dinheiro. Estou optando por receber outro produto novamente",1
"Funcionamento perfeito! Comparada com produtos similares, é a melhor do mercado. Insuperável em todos os quesitos, vale cada centavo!",5
"produto de excelente qualidade, superrecomendo, atingindo meus objetivos,",5
Só tinha 2 peças.com pequeno defeito mas de resto é maravilhoso,4
"Produto bonito e eficiente, atende as espectativas.",4
"Tudo certo. Produto bom, entrega no prazo. O primeiro produto apresentou defeito e foi realizada uma troca, o atendimento foi ótimo e a troca ocorreu sem burocracia e rapidamente. O novo produto chegou no prazo e atende plenamente às expectativas. Recomendo.",4
"Correspondeu às minhas necessidades, único ponto fraco e um pouco pesado talvez pelo fato do motor mais potente, e os botões que você tem que ficar segurando, mas de resto não tenho o que dizer de negativo",4
o produto é ótimo a entrega foi rápida estou muito satisfeita,5
"É coerente com a finalidade que se destina, tudo que foi proposto pelo fornecedor foi encontrado",4
"Por apenas R$1994.20,eu consegui comprar esse lindo copo de acrílico.",4
"Bom liquidificador, porem achei que tinha velocidade mais rapida, copo de bom tamanho....",4
"O produto não funciona com chip, já pedi devolução do meu dinheiro e até agora não houve contato por parte do fornecedor.",1
Produto apresenta uma boa qualidade até o momento e vem atendendo a minha expectativa.,4
Ótimo produto prático no começo e meio complicadoas qiamdo pega o jeito e b demais..,4
"Cumpre o que promete, super prático e a dor é suportável.",5
"É preciso dar tempo ao tempo, pra avaliar melhor.Mas espero que dure conforme as expectativas, ok ?",3
"O produto atende aos meus propósitos tais  como: rapidez,praticidade,mobilidade,eficiência.  Recomendo!",5
Ótimo custo benefício Comprem sem medo. Ótimo custo benefício,4
Só achei que viria com controle remoto. Deveriam incluir esse item.,3
"Comprei este produto e ele definitivamente não protege nada, é transparente mesmo, então não comprem, melhor usar uma fralda pendurada na janela.",1
"Imagem perfeita, era tudo o que eu queria para assistir filmes, alguns seriados e filmes que eu já tinha assistido me dão outro tipo de sensação assistindo nessa TV, até filmes e imagens antigas ficam diferenciadas, 4k é outro nível, recomendo.",5
Bom dia ainda não recebi o produto e nem foi gerado a nota fiscal. Já realizei uma reclamação anterior.   Fico no aguardo da resposta.,1
"Mesmo que nas características do produto esteja indicado, na descrição principal teria que dizer que é de 2017. seria bem mais simples para os compradores se fossem mais claras as descripcoes nos cadastros que vocês fazem.",1
"Produto ótimo, de qualidade.  Só demorou mt a chegar, mas de resto, não tenho do que me queixar!",5
Estou utilizando o hd faz uma semana e está funcionando conforme esperado. Recomendo.,5
Ótimo custo/benefício. Pelo preço pago o produto vale muito a pena.,3
Não sei informar a qualidade do produto pois não o recebi! Pela segunda vez consecutiva as lojas americanas não me entregou o produto dentro do prazo!!!,1
"O boneco ate recomendo , so que a pilha estava totalmente vazada dentro da caixa e estava uma nojeira. E quanto a compra nas Lojas Americanas eu recomendo,  deveriam abrir as caixas antes de entregar o produto pois se tivessem feito isso teriam trocado as pilhas com certeza.",3
"O produto é bom, de fácil montagem, e aparentemente de boa qualidade. A entrega que demorou um pouco mais que o previsto.",3
"Todas as peças em ótimo estado, bem embalado e prazo. Preços acessíveis isso é um fator importante quando faço pesquisa de preços e acabo comprando nas americanas.",4
"Os dois braços são do lado esquerdo, ficando esteticamente muito feio de um lado",1
Produto cumpre muito bem o que promete. Recomendo.,5
"MUITO LEVE E PRATICO FÁCIL DE LEVA, ÓTIMO PRA TRABALHOS DE FACULDADE.",5
"BOM O PRODUTO, CONFORME O ANUNCIADO E CHEGOU BEM RAPIDO",3
"Produto bom, de baixo custo, com material de baixa qualidade. Ziper é sensível, se não tomar cuidado pode estragá-lo.",3
sempre quiz uma dessa ... e agora foi um dos meus presentes de casamento... a pipoca fica grande e gostosa... sem contar q nao precisa de oleo p fazer e a entrega super rápida... resumindo Amei,5
"Chegou muito rapido, antes do esperado...e o produto funciona perfeitamente!!! Exatamente o que eu precisava.",5
Eu recomendo pois chegou rápido e foi de qualidade.,5
"Vamos dizer q é uma ""mão na roda"" como se diz kkkk. Um ótimo produto, pois ajuda na limpeza, como tbm ajuda na saúde. Pois não causa problema na coluna, movimentos do Mop facilita nossa vida.",4
"O desenho, a cor, potência, tudo muito bonito e bom.",4
Produto de boa qualidade... Adorei e a entrega foi rápida.,5
"Não esta funcionando, estou aguardando o retorno das lojas americanas.",1
"Máquina excelente pelo preço. Não deixou a desejar em nada, silenciosa.",5
